,id,talkName,dialogue,firstBtnText,secondBtnText,actionText,dialogue_Japanese
备注,索引id,强制名称,对白内容,第一个按钮文本,第二个按钮文本,action的文本参数,日配对白内容
,243101,,根据我们族内的传说：黑暗纪元时，魔族铁蹄侵入边陲沙漠。泰坦一族为守护森林全员战死，魔族也损失惨重，自那后再也不踏足此地。,,,,根据我们族内的传说：黑暗纪元时，魔族铁蹄侵入边陲沙漠。泰坦一族为守护森林全员战死，魔族也损失惨重，自那后再也不踏足此地。
,1014406,,可我并没有亲眼见过它们，毕竟自从罗兰战胜魔神后，再也没有人到过那儿。,,,,可我并没有亲眼见过它们，毕竟自从罗兰战胜魔神后，再也没有人到过那儿。
,1015303,,那当然！这个任务的酬劳不菲，我肯定是要赚的！,,,,那当然！这个任务的酬劳不菲，我肯定是要赚的！
,1356404,,不不不不，相信我，是真的！之前卖给我的人说这是跟怪盗联盟有关的！只有有它，想要什么都能有人给你弄到手！,,,,不不不不，相信我，是真的！之前卖给我的人说这是跟怪盗联盟有关的！只有有它，想要什么都能有人给你弄到手！
,1357803,,哈，大姐头，难不成这个通缉犯是你的粉丝了可你这么粗鲁……啊，大姐头￥%……&（我还什么都没说呢……别捏了，我错了！）,,,,哈，大姐头，难不成这个通缉犯是你的粉丝了可你这么粗鲁……啊，大姐头￥%……&（我还什么都没说呢……别捏了，我错了！）
,6112801,,（这个洞穴有着强烈魔力波动，看来这里就是大家所说的<color=#bd1011>入口</color>了。）,机会难得！赶紧进去瞧瞧。,还是再准备一下吧。,,（这个洞穴有着强烈魔力波动，看来这里就是大家所说的<color=#bd1011>入口</color>了。）
