,id,talkName,dialogue,firstBtnText,secondBtnText,actionText
备注,索引id,强制名称,对白内容,第一个按钮文本,第二个按钮文本,action的文本参数
,707801,,这批囚犯竟然如此大胆，仅仅几句危言耸听的谣言，就做出这种罪不可赦的事情！,,,
,707802,,提审的犯人有去无回？监狱勾结非法势力？？囚犯沦为实验品？？？这样荒谬的言论，也就他们会信！,,,
,707803,海地斯守卫,典狱长大人，现在我们该怎么办？再不控制局面，恐怕我们都……,,,
,707804,海地斯守卫,联系的帝国禁卫军迟迟未到，仅靠这里的兄弟们，怕是撑不了多久！而且那批囚犯都是亡命之徒，现在他们跟疯了一样！我们……,,,
,707805,,慌什么？能控制多少就先控制多少！正好刚才来了几个人，他们也会帮忙控制局面。我马上再联系薇莉丝大人，请她增派人手。,,,
,707806,海地斯守卫,是，典狱长大人。,,,
,707901,,那个魔族说是一名军官和她提议加入这次的行动。<br>你们觉得会是莱克吗？,,,
,707902,,这点无法保证，毕竟这里也关押了其他犯错的军官。<br>但是有一点可以肯定，这座监狱有古怪！,,,
,707903,,我也同意。谣言不是空穴来风，其中一定有原因。有一种可能是别人故意散布，还有另一种可能是……确有此事！,,,
,707904,,嗯，之前囚犯们提到的实验品，为人卖命，我有些担心。虽然不知道真假，但是还是有必要仔细调查一番。,,,
,707905,,我们只是来找史莱克，怎么就碰上了这件事？他们仿佛算好时间，特意引我们进来……,,,
,707906,,小子，也许正是你想的这样。不过事情真相到底怎么样，只有深入走下去才知道了。,,,
,708001,,史莱克根本不在第5层，典狱长为什么要告诉我们错误的信息？<br>这种一下就会被拆穿的谎言……,,,
,708002,,说不定他根本没有想到我们会活到第5层呢？,,,
,708003,,大姐头，这样可怕的事情，不要随便说出口啊！,,,
,708004,,啧，比这个可怕的猜想多了去了。就说这个监狱吧，如果它真的是一个实验场，那么它背后牵连到的人，说不定会是……,,,
,708005,,爱琳娜姐姐，会不会是莱克自己逃走了，又或许是典狱长<br>记错了……,,,
,708006,,但愿是这样吧。,,,
,708101,,温丽，西蒙，你们真觉得是典狱长记错了楼层？,,,
,708102,,（西蒙与温丽同时摇了摇头，表示不相信。）,,,
,708103,,我觉得守卫出现的时间点太凑巧了，还非常贴心地解释了莱克<br>的事情。,,,
,708104,,嗯，那个囚犯正想继续说什么的时候，守卫就带走了他。不过我有听到囚犯提到贵族二字，那么很有可能这件事情牵连到大家族。,,,
,708105,,看来没有白白外出冒险这么久，比以前强多了。结合之前犯人们说的话，我倒是觉得谣言是真的可能性更大了。,,,
,708106,,整件事真是越来越混乱了……我实在不愿意相信有贵族做出这样<br>的事，真希望谣言只是谣言……,,,
,708107,,世界上有光就有暗。虽然那些阴暗的事情让人难以接受，但是你要<br>学会面对啊。,,,
,708201,幽岚领主塔伦,看来上头给了你们不少好处，所以你们愿意这么卖命。但是我告诉你们，你们不会有好下场的。,,,
,708202,幽岚领主塔伦,迟早会像我一样，被抛弃，被关进这个吃人的监狱！,,,
,708203,,收买？抛弃？不要说这种模拟两可的话，把事情说清楚！,,,
,708204,幽岚领主塔伦,我忠心耿耿地替他们做事，甚至抛弃了家人！而他们呢？一旦我失去利用价值，便随便找了一个罪名把我关进来！,,,
,708205,幽岚领主塔伦,那批人有着尊贵的血液和最肮脏的内心！,,,
,708301,,喂！那些离谱的谣言，你是哪里听来的？<br>不想再吃拳头的话，老实交代。,,,
,708302,黑钢领主艾布林,科技已经如此发达，你还只是会用拳头的原始人。,,,
,708303,,哦，看来是还想再被揍。明白了，马上给你安排。<br>5，4，3……,,,
,708304,黑钢领主艾布林,是，是第5层的千纸领主洛伊告诉我的！她说只要将这些话传播<br>出去，可以确保我的安全。,,,
,708305,,呵，科技已经如此发达，你还是只会听信别人闲言的无脑人。,,,
,708401,,你是之前被抓起来的魔族！为什么你会和人类囚犯合作？,,,
,708402,苍蓝领主拉弥娅,你们还是像以前一样不可爱！身为魔族，如果一切变得混乱起来，<br>那多么美妙！,,,
,708403,苍蓝领主拉弥娅,所以啊，那位年轻的小军官和我提议的时候，我马上答应咯。,,,
,708404,,年轻军官……是莱克吗?,,,
,708405,苍蓝领主拉弥娅,不够帅的人，我是不会记住名字的。不过他啊，大概是想让你们这个虚伪做作的帝国，彻底坏掉吧，哈哈哈！,,,
,708406,,（苍蓝领主拉弥娅被重新关押起来，而屋内仿佛还在回荡着<br>   她嘲讽的笑声。西蒙等人思考着这些犯人所说的话。）,,,
,708407,,如果按照犯人们的话来推论，那么这个监狱的下层是秘密实验室，他们是实验品，而他们的反抗则是为了活下去。,,,
,708408,,嗯……感觉事情不像典狱长说得那样简单。这件监狱绝对有猫腻！,,,
,708409,,刚才的魔族提到了年轻的军官，或许就是史莱克。下一层就是他的关押地了，我们马上继续向下，找他问清楚吧！,,,
,708501,,你就是散布谣言的千纸领主洛伊？你这样做的目的究竟是什么？<br>还有，莱克被关在哪里？！,,,
,708502,千纸领主洛伊,小年轻，一看你就社会经验不够丰富。人嘛，最擅长的是趋利避害。至于我做的事情会造成什么不好的影响，和我有关吗？,,,
,708503,千纸领主洛伊,而莱克的去向……姐姐再教你们一个道理，好奇心会害死人。<br>好了，现在付出代价吧！,,,
,708601,,我也告诉你一个道理，自视甚高的下场就是这样！,,,
,708602,,爱琳娜姐姐，别理她了！莱克不见了！我和西蒙找遍所有角落，也没有发现莱克。,,,
,708603,千纸领主洛伊,呵，还没有发现吗？他早就不在这里了。他被拖到第10层了，现在去的话，你们只能找到变成实验品的躯体吧。,,,
,708604,,,,,
,708605,,12183号囚犯，出来。根据指令即刻调整关押楼层，押往第10层。,,,
,708606,,那边已经迫不及待了吗？<br>喂，你们不要忘了我们之间的交易。,,,
,708607,,磨蹭什么？快点！不许交头接耳！,,,
,708608,,敢推我？你，守卫马克么……我知道了。,,,
,708609,,你一个阶下囚，还这么嚣张！下去有你好受的，给我走快点！,,,
,708610,,蠢货。,,,
,708611,,莱克被守卫关到第10层了，典狱长为什么要说谎？,,,
,708612,,别急着下定论，说不定是这家伙在说谎。,,,
,708613,千纸领主洛伊,哈哈哈，我说谎？小年轻，被骗得团团转的是你们吧。,,,
,708614,,虽然不知真假，但是莱克的确不在这层，我们只能先向下寻找。<br>继续深入，或许能解开那些谜团。,,,
,708615,,嗯，马上出发吧。,,,
,708701,荒沼领主贝格,你们干脆给我一个痛快！待在看不见日月的地方，每天担惊受怕，唯恐下一个被带往下层的就是自己，我受够了……,,,
,708702,,你的声音怎么带上了鼻音……你，一个大男人，哭了？,,,
,708703,荒沼领主贝格,……生活已经如此艰难，我连哭的资格都没有吗？我们这些囚犯就是他们圈养的活体实验品啊！,,,
,708704,,他们是指谁？,,,
,708705,荒沼领主贝格,不用在我面前装傻，你们被派来控制我们，难道不清楚谁是上级吗？你们和那些贵族都是一伙的！,,,
,708706,,（此时，一名守卫匆匆跑来。他的出现打断了西蒙等人的问话。）,,,
,708707,,辛苦你们了，这里善后的事情交给我吧。,,,
,708708,,呃……好的。请问莱克是被移监到了第10层吗？之前典狱长告诉我们他被关押在第5层。,,,
,708709,,是的，12183号囚犯莱克已被移监到第10层。典狱长大人事务繁忙，或许是记错了。,,,
,708710,,好的，谢谢。<br>（西蒙等人虽然感觉有些奇怪，但还是决定往下寻找莱克。）,,,
,708801,,为什么你们的身上都有数字标记？之前几层的囚犯身上，我从来没有见到过。,,,
,708802,怒涛领主奥古斯,这个？哈哈哈，这是死亡号码牌！被打上标记的囚犯，犹如被雄狮盯上的猎物，无法逃脱，只有被捕食的命运。,,,
,708803,怒涛领主奥古斯,可是老子才不信命运，想活就只有靠自己！这个吃人的实验场，我一定会逃出去！,,,
,708901,狼蛛领主玛丽,你们……你们这群帮凶！啊——我的脚好疼！！！,,,
,708902,,你怎么了？怎么突然之间……<br>大小姐，你有没有什么办法帮她下？,,,
,708903,,这……我试试。,,,
,708904,,拯救汝辈的爱与魔法之精灵，听从吾之指引——<br>境界彼方的黑暗，消融于闪耀之辉。光之辉芒，起！,,,
,708905,狼蛛领主玛丽,好疼——我的脚要烧起来了，受不了了！了解我吧！<br>杰西法，我回不去了……就算回去，你也不认得我了吧……,,,
,708906,,怎么会一点效果都没有？！<br>（温丽讶异之余，细心检查了玛丽的身体。）,,,
,708907,,这……她，她的腿是移植的！还被感染得很严重……恐怕……,,,
,708908,,【哔——】，这里真的是实验室？！！他们不是胡说的？！<br>这也太【哔——】！,,,
,708909,狼蛛领主玛丽,咳……我们只是想活下去……而已……<br>杰西法，再见了……（玛丽缓缓合上双眼。）,,,
,708910,,……温丽，大姐头，除了找到莱克，我们还要弄清这座监狱到底发生了什么！,,,
,708911,,嗯，继续向下吧。,,,
