,id,talkName,dialogue,firstBtnText,secondBtnText,actionText
备注,索引id,强制名称,对白内容,第一个按钮文本,第二个按钮文本,action的文本参数
,683203,,为了保证后代顺利降生，异虫会吸引其他虫类充当护卫。<br>以防万一，这是<color=#bd4104>5</color>瓶<color=#bd4104>除虫喷雾</color>，你们记得用。,,,
,683301,,哟，你们来啦，调查还在继续，这次就和上次一样麻烦你们<br>啦！老样子，这是<color=#bd4104>5</color>瓶<color=#bd4104>除虫喷雾</color>，你们记得用。,,,
,683501,,<color=#bd4104>除虫喷雾</color>用完了？西蒙你怎么才说……<br>以防万一，我们还是尽快出去吧。,,,
,684401,,那边那些商人们遗失的货箱里似乎还有一些除虫喷雾，<br>你们也可以试着找找看，说不定还有剩下的。,,,
,683701,,快看，这货箱里还有<color=#bd4104>1</color>瓶<color=#bd4104>除虫喷雾</color>！,,,
