,id,talkName,dialogue,firstBtnText,secondBtnText,actionText,dialogue_Japanese
备注,索引id,强制名称,对白内容,第一个按钮文本,第二个按钮文本,action的文本参数,日配对白内容
,663501,,你们听着，马上放下手中的武器！我们可以不追究你们的责任。再继续下去，后果不是你们能承担的！,,,,
,663502,,别开玩笑了！放下武器，成为你们开不了口的实验品吗？小的们，<br>给我干掉他们！不然死的人，就是我们！,,,,
,663503,,该死，援兵怎么还不来……嗯？他们是……管不了那么多了。喂，<br>你们！对，不要转头了，就是你们！快来帮忙制服他们！,,,,
,663504,,嗯？！我们？好吧，虽然不知道什么情况，但是先帮忙吧。,,,,
,663505,,心急如焚的典狱长提示：犯人头目铁卫领主阿特斯已经控制本层，并启动预先设下的魔法阵，利用它汲取帮手的力量，为自身进行加持。,,,,
,695201,,（在老船长的指引下，西蒙等人顺利进入海地斯监狱。而他们刚踏入<br>    监狱，砰——一柄斧头向他们袭来。）,,,,
