,id,talkName,dialogue,firstBtnText,secondBtnText,actionText
,657602,,管他什么原因，等我们把他们都抓住后，暴打一顿，然后把<br>一切都问个明明白白，还能顺便将<color=#bd4104>经验奖励</color>搞到手。,,,
,657701,,快点，圣界的人带着扬博士往那个方向逃走了！,,,
,657702,,#￥%，那该死的博士害死了那么多无辜的生物，<br>必须让他接受制裁，同时抢回属于我们的<color=#bd4104>经验奖励</color>！,,,
,657801,,那个圣界的小女孩身手确实厉害，<br>看来要拿到<color=#bd4104>经验奖励</color>也不是那么容易的。,,,
,657802,,有我的追踪魔法，他们逃不掉的。那扬博士为了研究生化武<br>器，居然伤害了那么多的生物，绝对不可饶了他。,,,
,657901,,这个扬博士实在太狡猾了，每次都被他逃掉。<br>可恶，每次都被圣界的人阻扰！,,,
,657902,,给点自信，这次我们不会再让他们逃掉的！<br>快点，只要我们战胜了她们，就可以拿到丰厚的<color=#bd4104>经验奖励</color>。,,,
,658001,,我是扬博士，汪，你们休想从这里通过，汪汪！<br>不用怀疑，我就是你们一直追寻的扬博士。,,,
,658002,,好你个扬博士……个大头鬼。<br>可恶，居然用这种低端的手段来拖住我们的脚步！,,,
,658101,,没想到这个假的扬博士居然也花了我们不少时间。<br>我们赶紧加快搜索速度。敌人和宝藏，一样都不能少！,,,
,658201,,真是太辛苦了！我打算买两块南瓜饼犒劳自己！,,,
,658301,,一下子获得这么多<color=#bd4104>经验奖励</color>，真是世界上最让人开心的事！,,,
,658601,,就这样离开了吗？<br>直觉告诉我这里似乎还隐藏了许多宝藏。,继续寻找。,开启宝箱，结束本次冒险。,
,658701,,走？开什么玩笑？<br><color=#bd4104>经验奖励</color>还没有拿完，怎么能走？！,继续寻找。,开启宝箱，结束本次冒险。,
,658801,,我们再四处看看吧，或许有遗漏的宝藏。,继续寻找。,开启宝箱，结束本次冒险。,
,658901,,就这样离开不符合大姐头的性格啊！<br>再找找还有什么其他宝藏。,继续寻找。,开启宝箱，结束本次冒险。,
,659001,,还有其他的地方没有走过，<br>我们再继续看看吧。,继续寻找。,开启宝箱，结束本次冒险。,
,659101,,好啦，大姐头。<br>宝藏拿得够多了，我们回去吧。,,,
,659201,,既然宝箱都拿到了，我们就回去吧。,,,
,659301,,这次真是收获满满啊！,,,
,659401,,谢天谢地，终于可以离开这里了！,,,
,659501,,累死了，跑了这么一圈，肚子都饿爆了！,,,
,659601,,太可怜了，那个扬博士为了制作自己的替身，<br>居然将这些生物弄成这个样子！不可饶恕！,,,
,659602,,我……是……扬……博……士。,,,
,659701,,啊！那个扬博士怎么能做出这种事情，<br>这些生物的样子……我真的生气了，不能放过他！,,,
,659702,,我……真……的……是……扬……博……士。,,,
,659801,,这个生物应该跟刚才的那些怪物是一样的，<br>被扬博士进行了改造，成为他的替身……,,,
,659802,,我……会……守……护……这……个……地……方。,,,
,659901,,难以置信，那个扬博士居然为了逃跑，做出这么丧心病狂的<br>事情，原来刚才的那些替身是这么来的……,,,
,659902,,我……是……谁？<br>我……好……痛……苦！扬……博……士？博……士……,,,
,660001,,这些替身太可怜了，居然变成这样子。话说他们跟成功品相<br>比，头上毛发多好多啊！等等，他们失败的原因不会是……,,,
,660002,,啊呜……啊……啊……呜。<br>博……博博博博……扬……博……博……士。,,,
,660101,,不好，这是魔箱兽！,,,
,660201,,竟然是魔族的魔箱兽？<br>也太扫兴了吧！,,,
,660301,,魔箱兽竟然会出现在这里，<br>看来魔族与黑龙战舰之间，有着千丝万缕的关系。,,,
,660401,,本大小姐要生气了！,,,
,660501,,我就说吧，哪有什么天上掉馅饼的好事啊！<br>还好这个魔箱兽没什么难度。,,,
,660601,,魔箱兽是魔族的东西，<br>看来有魔族的人曾经来过这里。,,,
,660701,,你们圣界的人到底有什么企图？<br>可恶，居然无视我们。,,,
,660702,,他们为什么要一直追着我们啊？<br>莉莉，再不把他们撕碎，会错过跟乔伊约好的时间的。,,,
,660801,,这是扬博士做实验用的培养器？要不我们调查一下好了。<br>……等等，里面有怪物，大家小心！,,,
,660901,,这里怎么会有培养器，真是可疑……<br>不好，真的是怪物！,,,
,661001,,不好，培养器里的怪物苏醒过来了，<br>大家准备迎击怪物！,,,
,661101,,我的侦测魔法探索到附近有生物的征兆。<br>大家千万不要大意，应该有埋伏。,,,
,661201,,一路上居然都没有遇到任何的怪物，真幸……<br>啊！培养器里有怪物！,,,
,661301,,果然是这样！安德烈博士的恶趣味……<br>不过，我喜欢。,,,
,661401,,可是我转了下蜡烛，另外一堵屏障打开了。,,,
,661402,,不是说让你不要动吗？这次被你误打误撞了，下次呢？<br>电视剧里活不过两集的人，说的就是你！,,,
,661403,,大姐头，你不要这么激动。我下次……<br>好，我保证没有下次。,,,
,661501,,*#@！这些枭鹰真是阴魂不散，在这里都可以见到它们！<br>看来是时候想个办法把它们一锅端了。,,,
,661502,,爱琳娜姐姐别激动，捉拿亚兹莫后再考虑这些也不迟啊！,,,
,661701,,嗨，亲爱的冒险者们又见面了！我是你们可爱的广播向导！<br>你们现在进入的是黯月城第一层，这里的主人是炼狱之主。,,,
,661702,,从这一层开始，试炼的难度开始增加了哦！<br>你们已经是成熟的熟练工了，我相信大家！,,,
,661801,,这扇门受两个魔法阵控制——靠近这门的那两个，<br>只要破解任意一个魔法阵，就能打开它。,,,
,661901,,上吧冒险者们，让他直接扑街！,几秒就能结束战斗！,舒展下筋骨，等会再战！,
,662001,,（出战的英雄们十分默契地重新站在了魔法阵上，他们将维持空间魔法恒定，防止炼狱之主再次获得生命之源特性。）,,,
,662101,,（出战的英雄们十分默契地重新站在了魔法阵上，他们将维持空间魔法恒定，防止炼狱之主再次获得生命之源特性。）,,,
,662102,,这扇门已经开启。如果想要和本层主人面对面，还需要<br>继续往前走，开启第2扇门。,,,
,662201,,上吧冒险者们，让他直接扑街！,准备好了，开始战斗！,休息一会，等会再战！,
,662301,,（出战的英雄们十分默契地重新站在了魔法阵上，他们将维持空间魔法恒定，防止炼狱之主再次获得力量之源特性。）,,,
,662401,,（出战的英雄们十分默契地重新站在了魔法阵上，他们将维持空间魔法恒定，防止炼狱之主再次获得力量之源特性。）,,,
,662402,,这扇门已经开启。如果想要和本层主人面对面，还需要<br>继续往前走，开启第2扇门。,,,
,662501,,这是第2扇门，受两个魔法阵控制——靠近这门的那两个，<br>只要破解任意一个魔法阵，就能打开它。,,,
,662601,,上吧冒险者们，让他直接扑街！,分分钟就干掉他！,他看起来有点厉害，等会再战！,
,662701,,（出战的英雄们十分默契地重新站在了魔法阵上，他们将维持空间魔法恒定，防止炼狱之主再次获得伤害免疫特性。）,,,
,662801,,（出战的英雄们十分默契地重新站在了魔法阵上，他们将维持空间魔法恒定，防止炼狱之主再次获得伤害免疫特性。）,,,
,662802,,这扇门已经开启。本层主人就在里面，冲啊冒险者们！,,,
,662901,,上吧冒险者们，让他直接扑街！,马上就解决他！,打得好累啊，等会再战！,
,663001,,（出战的英雄们十分默契地重新站在了魔法阵上，他们将维持空间魔法恒定，防止炼狱之主再次获得灼烧特性。）,,,
,663101,,（出战的英雄们十分默契地重新站在了魔法阵上，他们将维持空间魔法恒定，防止炼狱之主再次获得灼烧特性。）,,,
,663102,,这扇门已经开启。如果想要和本层主人面对面，还需要<br>继续往前走，开启第2扇门。,,,
,663201,,炼狱之主已经失去全部特性了。去吧，战胜他！,成功就在眼前，干翻他！,不着急，等会再战。,
,663301,,炼狱之主身上还有特性没有消除，真的不考虑将所有魔法阵<br>都破解后，再战斗吗？,不碍事，直接上！,好吧，还是等会再战吧！,
,663401,,少了广播絮絮叨叨的讲解，感觉我们的战斗水平直线上升！,,,
,663402,,真可惜，我听说如果去投诉广播唠叨，可以获得<br>一笔丰厚的赔偿金。,,,
,663403,,（当我不存在吗！虽然很气，可为了不被投诉，还是要保<br>持职业素养！）祝贺各位又顺利闯过一层，我们下次再见。,,,
,663501,,（西蒙等人刚踏进黯月城，身后的城门便立即关上。同时，<br>每个人的耳边，传来了冒险者专用频道的广播声。）,,,
,663502,,嗨冒险者们，欢迎来到——黯月城。这是魔法协会利用空间魔法包围的试炼场，这里的所有魔族都是虚拟出来的哦！,,,
,663503,,如果你一步一步往里走，你还会诧异地发现，这里每一层都<br>惊人的相似！惊不惊讶？其实，这只是魔法师们偷懒而已。,,,
,663504,,这个广播怎么这么聒噪。正常的广播介绍不应该简单粗暴<br>直接吗？,,,
,663505,,喂喂喂，这么快就不耐烦了吗？事无巨细介绍规则，是我的<br>基本素养。在经历999次投诉后，这已经是简略版了啊喂。,,,
,663601,,好吧，那我们开始重点。这一层的主人是贪狼暴君，他看<br>起来是有点凶啦，而且有了两个魔法阵加持后变得更凶了！,,,
,663701,,左边的魔法阵——生命源力，贪狼暴君可通过它汲取孤狼<br>傀儡的生命，使自身生命上限得到了100％的提升加成。,,,
,663801,,右边的魔法阵，是力量源力。和刚刚那个差不多的原理，贪<br>狼暴君因梦魇白狼的力量，自身攻击力得到了50％的提升。,,,
,663901,,真@！#啰嗦。直接一句话：两个魔法阵为贪狼暴君增加了<br>特性，不就成了？说吧，怎么才能打爆他们！,,,
,663902,,虽然我很想直接告诉你，但播放守则里不允许我提前告诉你<br>们哦。加油，你们可以的，接下来我会一直与你们同在。,,,
,663903,,这个广播就这样消失了？贱兮兮的语气真的太欠扁了！<br>不要说大姐头，我都要受不了……咦，怎么还有声音？,,,
,663904,,喂喂喂，背后说人坏话真的好吗！还有一条提示忘了说啦，<br>你们随时都可以点击副本信息界面，查看该层魔物特性。,,,
,664001,,嘿嘿，亲爱的冒险者们，我猜到你们现在非常需要提示！这<br>扇门受两个魔法阵控制，只需破解任意一个，就能开启。,,,
,664101,,"（见到魔物，众人并没有急着动手， 而是在心里默默数起了<br>数。果然，众人刚数到2，,黯月城广播就出现了。）",,,
,664102,,咳咳，最怕空气突然的安静，大家活动活动筋骨啊！好吧，<br>既然大家都很期待我的讲解，那我就开始吧！,,,
,664103,,战胜孤狼傀儡，就可以破解魔法阵，同时魔法阵的源力输送<br>因此中断，贪狼暴君失去生命之源特性。,,,
,664104,,不过嘛，出战后的英雄，在后续战斗中将<color=#bd4104>无法继续出战</color>。,,,
,664105,,由于空间魔法恒定，魔法阵上需要出战英雄维持恒定魔力。<br>否则魔法阵将重聚魔族，使贪狼暴君重新获得生命之源。,直接干掉他就是了！,真麻烦，等下再打他！,
,664201,,暴君大人，对不起！我没能守住魔法阵！他们太强了，<br>我这具虚拟的身躯根本.......,,,
,664202,,没用的废物！这就是为什么，虽然同样是魔法创造出来的，<br>可你只能为我提供魔力，而我却是王者！,,,
,664203,,大人！！只要他们离开魔法阵，空间魔法恒定就能将我复活<br>.......可（孤狼傀儡的残识渐渐消散，直至完全看不见踪影）,,,
,664204,,真是废物。算了，没有这生命源力的加持又如何？只要我<br>存在，就能让那群冒险者，滚出我的地盘。,,,
,664301,,暴君大人，对不起！我没能守住魔法阵！他们太强了，<br>我这具虚拟的身躯根本.......,,,
,664302,,没用的废物！这就是为什么，虽然同样是魔法创造出来的，<br>可你只能为我提供魔力，而我却是王者！,,,
,664303,,大人！！只要他们离开魔法阵，空间魔法恒定就能将我复活<br>.......可（孤狼傀儡的残识渐渐消散，直至完全看不见踪影）,,,
,664304,,真是废物。算了，没有这生命源力的加持又如何？只要我<br>存在，就能让那群冒险者，滚出我的地盘。,,,
,664401,,智能广播不厌其烦的战斗提示：战胜梦魇白狼，就可以破解<br>魔法阵，贪狼暴君因此获得的力量之源特性也会消失。,,,
,664402,,出战后的英雄，在后续战斗中将<color=#bd4104>无法继续出战</color>。你们<br>不要偷偷背着我翻白眼！这可是需要拿红笔划横线的重点！,,,
,664403,,由于空间魔法恒定，魔法阵上需要出战英雄维持恒定魔力。<br>否则魔法阵将重聚魔族，使贪狼暴君重新获得力量之源。,既然这样，那就打爆他！,有点棘手，那就先放过他！,
,664501,,暴君大人，我感觉到自己快要消失了！！啊，是虚无，是虚<br>无在召唤我！,,,
,664502,,废物，回归虚无就这么值得高兴？,,,
,664503,,不是的大人。是这种渐渐消失的空虚感令我快乐！这种激动<br>，就像我为大人输送力量时的那种空虚感，令我浑身沸腾！,,,
,664504,,废物，满脑子只有垃圾！该死，这群人一刻不离开魔法阵，<br>我的力量之源特性就回不来。,,,
,664601,,暴君大人，我感觉到自己快要消失了！！啊，是虚无，是虚<br>无在召唤我！,,,
,664602,,废物，回归虚无就这么值得高兴？,,,
,664603,,不是的大人。是这种渐渐消失的空虚感令我快乐！这种激动<br>，就像我为大人输送力量时的那种空虚感，令我浑身沸腾！,,,
,664604,,废物，满脑子只有垃圾！该死，这群人一刻不离开魔法阵，<br>我的力量之源特性就回不来。,,,
,664701,,呵，废物冒险者们，废话不多说，直接开战吧。<br>就算我没了两个特性加成，也能轻松捏死你们。,最后的战斗绝不能掉以轻心！,等等！休息一会后再战！,
,664801,,哦？把我那个废物手下击败的人就是你们？<br>也不过是群歪瓜裂枣们。,,,
,664802,,哔哔哔哔，冒险大提示！！由于还有一个魔法阵未破解，<br>所以贪狼暴君身上还存有一个特性。现在战斗会加大难度！,,,
,664803,,冒险者们，你们确定要现在战斗吗！虽然他只是魔法虚拟<br>出来的生物啦，但还是具有很高危险性的哦！,,,
,664804,,吵死了。哪里的声音像个苍蝇一样嗡嗡嗡吵个不停！<br>我可不是虚拟生物，我是真实的存在！我有自己的意识！！,,,
,664805,,哎呀呀，一个没注意开启了全地图广播……要被罚工资了。,就算还有特性，照样干翻他！,这不是好时机，等会再战！,
,664901,,诶诶诶，我就去泡个茶的功夫，你们居然已经把贪狼暴君<br>打趴了？哇，这也太快了吧.......,,,
,664902,,嗯？！@#！我怎么听着你的口气有点遗憾？？<br>反正试炼也已经结束了，我现在就把你找出来砸个稀巴烂！,,,
,664903,,喂，这位红头发的大姐头，好歹我也陪伴了你们这一路吧！<br>居然这么狠心！我其实是在遗憾这段时光居然如此短暂！,,,
,664904,,虽然只有短短的几十分钟，可我耐心的讲解，一定让大家<br>如沐春风，豁然开朗。如果各位十分满意，记得五星好.......,,,
,664905,,大姐头，这地板掀不开的.......墙壁也是.......大小姐，我们快<br>出去吧！不然这里就要被暴走的大姐头给拆了。,,,
,665101,,嗨，亲爱的冒险者们又见面了！我是你们可爱的广播向导！<br>你们已经是成熟的熟练工了，希望你们能学会自己试炼！,,,
,665201,,上吧冒险者们，让他直接扑街！,几秒就能结束战斗！,舒展下筋骨，等会再战！,
,665301,,上吧冒险者们，让他直接扑街！,准备好了，开始战斗！,调整下状态，等会再战！,
,665401,,他已经失去全部特性了，冲呀，战胜他就能完成<br>该层试炼。,一鼓作气干掉他！,不急，休息一会再战。,
,665501,,一本正经的冒险提示：因为你们还有1个魔法阵未能破解，<br>所以他的身上还有1个特性。磨刀不误砍柴工啊朋友们。,不废话，直接上！,思考了一下，还是等会再战吧！,
,665601,,热烈撒花，祝贺大家又闯过一层！美好的时光总是如此短<br>暂，期待在下一层还能见到你们。各位记得给我五星……,,,
,665602,,你这次的表现我很满意，安静如鸡，干练简洁。<br>不过，呵呵，如果你现在再说一句话，就给你一星差评！,,,
,665701,,嗨，亲爱的冒险者们又见面了！我是你们可爱的广播向导！<br>你们已经是成熟的熟练工了，希望你们能学会自己试炼！,,,
,665801,,上吧冒险者们，让他直接扑街！,几秒就能结束战斗！,舒展下筋骨，等会再战！,
,665901,,上吧冒险者们，让他直接扑街！,准备好了，开始战斗！,调整下状态，等会再战！,
,666001,,他已经失去全部特性了，冲呀，战胜他就能完成<br>该层试炼。,一鼓作气干掉他！,不急，休息一会再战。,
,666101,,一本正经的冒险提示：因为你们还有魔法阵未能破解，<br>所以他的身上还有特性。磨刀不误砍柴工啊朋友们。,不废话，直接上！,思考了一下，还是等会再战吧！,
,666201,,热烈撒花，祝贺大家又闯过一层！美好的时光总是如此短<br>暂，期待在下一层还能见到你们。各位记得给我五星……,,,
,666202,,你这次的表现我很满意，安静如鸡，干练简洁。<br>不过，呵呵，如果你现在再说一句话，就给你一星差评！,,,
,666301,,扬博士到底在哪里，你们圣界的人为什么要一直庇护他。,,,
,666302,,莉莉，如果他们能跟你一样，安静地呆着那多好啊！<br>嗯，我们一起把他们叠起来好了。,,,
,666401,,莉莉，我不喜欢他们一直追着我，<br>你愿意帮我把他们揉成一团吗？,,,
,666402,,你这小女孩，怎么这么不讨人喜欢呢？<br>如果你还不赶紧让开，就不要怪我狠狠地教训你了。,,,
,666501,,可恶，没想到还有人守在这里。<br>这样下去，那个扬博士又要逃掉了。,,,
,666502,,莉莉，博士很早就逃走了，为什么他们还要一直追着我？<br>这样做根本没有任何意义啊！,,,
,666503,,你……我们将你击败后，很快便能追上那该死的博士！,,,
,666601,,快点让开，我们知道扬博士就在后面。<br>为了那些被他残害的生命，这次我们一定要把他抓住。,,,
,666602,,莉莉，我真的很讨厌那个博士，但既然乔伊说了他还有用，<br>那我们还是帮帮他吧！,,,
,666603,,#￥@%，果然在这种时候，还是拳头好用。,,,
,668501,,啧，废物冒险者们，麻利点给我滚过来吧！<br>我的耐心有限！,,,
,668601,,啧，门开了。废物冒险者们，我倒是想看看你们到底配不配<br>闯进我的地盘。,,,
,668901,,（贴心的芙蕾雅魔法师提醒：注意团队间的配合，一名队友<br>留守此处，另一名队友前去取宝物，是最优方案哦。）,,,
,673201,,这样就没人可以认出我们了，我们去救小女孩,,,
,676601,,这么多魔物！每一只都正面迎战的话，右相都不知道跑<br>哪里去了。,,,
,676701,,这里是靠火把照明么？呵呵，我有主意了。,,,
,676702,,经验丰富的赏金猎人提示：减弱火焰的大小，可以缩小魔物<br>们的视野范围，方便展开追击。,,,
,676801,,真的耶，变暗后，魔物们的视野范围变小了。<br>这下可以轻松避开它们了！,,,
,676802,,给我小声点！它们是看不清，不是听不见。<br>趁它们还没有反应过来，我们赶快走。,,,
,676901,,她就在前面，我们过去吧。,,,
,677001,,大小姐，变装的主意是不错……<br>可是我感觉好难受啊，走路好变扭……,,,
,677002,,你忍一下，这样才能安全地救出小萨莎。<br>对，对，对，就这样走，步子不要太大，少女些……,,,
,677101,,站住！新面孔？什么时候加入的？叫什么名字？<br>不说话？那我动手了！,,,
,677102,,糟糕，被发现了……那就大干一场吧！,,,
,677301,,哎哟，以为躲在这里，我就会漏过你吗？<br>我早就闻到你身上散发的迷人香气。啊，金钱的味道。,,,
,677302,,恶恶恶……恶魔！你们人类才是人间恶魔！<br>我要带上我的小钱袋，离开这个可怕的地方。,,,
,677401,,,,,
,677501,,我还没有对他做什么，至于这么怕吗？<br>怕到忘记了他的小钱袋……,,,
,677601,,视财如命的哥布林，他的宝箱里有什么呢？<br>让我来看看……&%￥#，会动！,,,
,677701,,哥布林果然阴险狡诈，差点被暗算了！<br>等着吧，我可不会轻易放过你们……,,,
,677702,,好啦，爱琳娜姐姐，他也被你打得眼冒金星了，<br>你就别生气了。,,,
,678501,,我没有说错吧，我就说那些位高权重的人就喜欢将自己的宝<br>物藏在一些奇奇怪怪的地方。话说，这里的魔气还真重。,,,
,678502,,老师他……诺尔他应该是利用这里充满魔气的特点来隐藏这<br>个地点。对了，这么重的魔气肯定会有很多魔物，大家……,,,
,678503,,小心一点对吧？事关<color=#bd4104>银币</color>，我当然会非常小心。<br>至于魔物，我们尽量避开它们就行了。,,,
,678601,,很好，拿到很多银币了，我们快离开吧！<br>我感觉有越来越多的魔物在靠近，赶紧走！,,,
,678701,,据说这里的遗迹历史可追溯到神法时期。<br>可惜经过黑暗纪元后，现在这里已经被魔物占领。,,,
,678702,,只有敢进来才有机会拿到珍贵的宝藏，不是么？<br>我们小心绕开那些魔物，将目光集中在那些角落的<color=#bd4104>银币</color>吧！,,,
,678801,,我们已经拿到够多的<color=#bd4104>银币</color>了。<br>而且，宝箱也拿到手了，还是快点回去吧！,,,
,679101,,这就是传说中的哥布林宝库吗？<br>没想到啊！这种生物可真是富得流油。,,,
,679102,,这里有很多哥布林看守，我们要小心些。喂，大姐头，大<br>姐头？！好吧，感觉你已经完全被那些<color=#bd4104>银币</color>吸引住了。,,,
,679201,,有惊无险，找到了这么多的好东西。<br>趁哥布林还没有反应过来，我们快点离开吧！,,,
,679301,,这里就是黑曜矿洞？<br>没想到这里这么大，里面肯定有很多宝物。,,,
,679302,,这里不错吧！放心，里面的黑曜矿绝不会让你们失望的。<br>难得相识一场，这5把精钢矿镐就送给你们作为见面礼吧！,,,
,679401,,上次的收获不错，今天要再接再厉，找到更多好东西。,,,
,679402,,很高兴又见到你们。不错，保持你们的斗志与激情。<br>收下新的5把精钢矿镐吧，说不定你们这次能有大收获。,,,
,679501,,喂，这是我发现的黑曜矿坑，里面的矿藏只有我能开采。<br>你们走开！快走开！不然我就要喊救命了！,,,
,679502,,矿藏是公有资源，你怎么能私自占有呢？<br>再说了，这个矿坑这么大，你一个人根本开采不完啊！,,,
,679601,,你鬼鬼祟祟地在那边做什么？矿洞里的资源是公有的，<br>你不能厚着脸皮将它们独自霸占，还藏起来不让别人找到。,,,
,679602,,……你知道我奶奶怎么活到九十吗？<br>快滚开，我把精钢矿镐藏在宝箱里的秘密可不会让你知道。,,,
,679701,,奇怪，我明明记得那些贪心的老矿工喜欢将好东西藏在这个<br>巨石下面，难道我记错了吗？不可能啊！,,,
,679702,,喂喂喂，你们听到了吗？巨石下的好东西？<br>快，我们快找巨石下找找，绝对不能错过所有的好东西。,,,
,679901,,西蒙，这里也有黑曜矿，你可别看漏了。<br>精钢矿镐应该都在你那里，我们快点采集吧！,,,
,679902,,……那个，我们已经没有精钢矿镐了。<br>如果没有它，我们可无法采集这些黑曜矿。,,,
,680101,,西蒙，这里也有黑曜矿，你可别看漏了。<br>精钢矿镐应该都在你那里，我们快点采集吧！,,,
,680102,,……那个，我们已经没有精钢矿镐了。<br>看来是无法继续采集了，今天我们先离开好了。,,,
,680201,,快过来，这里还真有好东西。<br>看来那些采矿者真的喜欢将自己的宝物藏在宝箱里。,,,
,680202,,虽然就这样拿走这些宝物有点不太好，<br>但这些都是他们违规私藏的，我可不会对他们客气。,,,
