,id,talkName,dialogue,firstBtnText,secondBtnText,actionText
,1141002,,哈哈，蕾茵小可爱，你一直都是最棒的。谢谢你们救回了蕾<br>茵，奔波了一天，留下休息一晚再走吧。,,,
,1141101,,,,,
,1141102,,,,,
,1141103,,啊——不！！！<br>有没有搞错，本大小姐已经三连败了！,,,
,1141104,,温丽，温丽，你怎么了？隔着一个房间都能听到你的惨叫。,,,
,1141105,,西蒙你……我才没事呢，只不过是做噩梦了而已。<br>那个……反正也醒了，我们出去散步吧。,,,
,1141201,,,,,
,1141202,,圣界的人！我要抓住她，绝不让她逃掉！！,,,
,1141203,,你先不要激动。她半夜三更出现在这里，一定是想做什么。<br>我们悄悄跟上去，说不定有意外的收获。,,,
,1141301,,我伟大的实验全毁了！亚兹莫让你们来帮我，<br>你们都做了什么？我早就和他说过，人类靠不住！,,,
,1141302,,不过是个小实验，尼格斯会帮他完成的。<br>他为什么要到处乱跑呢，莉莉？,,,
,1141303,,小实验？我的实验成功的话，它将成为称霸海陆空的<br>最强生化武器！你知道吗？！！！,,,
,1141304,,没兴趣。乔伊要的神器·燃金之泪，找到了吗？,,,
,1141305,,没有！没有！我可不是来帮你找东西的。我的实验……<br>对！去那里的话，一定有办法！我会成功的！哈哈哈！,,,
,1141306,,啊~他真不听话，要不把他剪成你的同伴？名字叫扬扬。<br>啊，不行。那样的话，乔伊会不开心。啊~怎么办，莉莉？,,,
,1141307,,喂，你居然还不死心，还想做生化实验？！<br>至于你们圣界，到底想做什么？,,,
,1141308,,又是你们。既然不能撕掉他，那就揉碎你们吧。<br>呵呵，就这么办，莉莉。,奥兹家族的剑士不会输！,稍后再战。,
,1141401,,可恶，让她逃走了！连扬博士也溜走了。圣界的人<br>来了这里，或许哥哥也在……不行，我要追上去！,,,
,1141501,,说，你们的目的究竟是什么？！<br>还有，我哥哥呢？,,,
,1141502,,莉莉，姓奥兹的人，都让人讨厌。<br>不管是他，还是兰奇。,,,
,1141503,,虽然我从不和女孩子动手，<br>但是如果你再不说的话，我就……,,,
,1141601,,动作真慢，尼格斯。,,,
,1141602,,没有礼貌的丫头，这是你对我该有的态度吗？,,,
,1141603,,他们……就是毁了我实验计划的人？<br>扰乱我计划的人，都不能原谅。,,,
,1141604,,不要管你的实验了。<br>完成乔伊交代的事情，才是最重要的。,,,
,1141605,,喂，放完狠话，就想跑？想得美！,,,
,1141701,,哎呀，动作太慢，追不上了哦~小果实们~,,,
,1141702,,你也在这里？那么我哥哥是不是也在，我要见他！,,,
,1141703,,嘘，小声点哦！不要被发现了~我来找你们，<br>可是秘密哦，小果实们~~,,,
,1141704,,耐心点，兰奇的话~他可是准备了一个大惊喜要送给你~<br>哎呀，说得自己都期待起来了~,,,
,1141705,,什么惊喜？把话说清楚！,,,
,1141706,,不行哦~要保密，不然就不是惊喜了~<br>不过，你们不回去看看小人鱼吗？说不定默希娅已经……,,,
,1141707,,糟了，刚刚默希娅是从蕾茵家附近离开的！<br>难道她……我们快回去看看！,,,
,1141801,,（众人跑至蕾茵家门口，大声呼喊蕾茵。）,,,
,1141802,,来啦，来啦。<br>你们看起来好紧张啊，是发生什么事情了吗？,,,
,1141803,,你没事，真是太好了！<br>那个变态，是故意引我们离开的。,,,
,1141804,,你们在担心蕾茵啊，谢谢，谢谢，谢谢！<br>蕾茵很好哦，一点事都没有。,,,
,1141805,,既然你平安无事，那我们就出发去<color=#bd4104>阿诺特岛</color>了。<br>记住，以后不要再做傻事，不然会有人担心的。,,,
,1141901,,长老，我们想问下去阿诺特岛需要准备什么。,,,
,1141902,,阿诺特山脉里有很多毒虫，一旦被咬到，脸肿成猪头都<br>算轻的了。想要保住颜值，必须带上有驱虫效果的<color=#bd4104>龟纹叶</color>。,,,
,1141903,,然后……就是填饱肚子，毕竟山路难走，体力消耗大。<br>这样吧，我为你们烹饪龟村特色菜肴——肥熊茶渍饭。,,,
,1141904,,不过我手头没有食材，你们帮我猎来<color=#bd4104>棕尾熊</color>吧。<br>我先去磨一磨我的宝刀……,,,
,1142001,,龟纹叶，叶如其名。<br>绝对是它了。,,,
,1142101,,别怪本大小姐。<br>在美食面前，我毫无抵抗力。,为了我的胃，对不起啦！,不够肥，再养养。,
,1142201,,好撑呀，不过真是太好吃了！<br>现在我感觉自己浑身都充满了力量！,,,
,1142202,,既然如此，那就赶紧出发吧！<br>我们要尽快抵达阿诺特岛。,,,
,1142301,,别想走，把话说清楚！<br>你们一路收集神器是为了什么？,这次不会让你逃跑！,缓口气，再战。,
,1142501,,探宝家梅尔·霍克森留下的探宝图鉴么？<br>居然有这么多张，太幸运了，看来今天会有大收获！,,,
,1142502,,大姐头，探宝没有次数限制……<br>不过你不会想一天之内把这些地方全部探遍吧？,,,
,1142503,,怎么，你想反抗？<br>马上出发吧，说不定有机会探寻到隐秘的藏宝洞呢,,,
,1143101,,爱护树木，人人有责。木禅的伤势还需要修养，<br>请耐心等候。等候期间，你可以去自律联盟修行。,,,
,1143201,,木禅已经完全康复了，接下来的旅行<br>又多了一位可靠的同伴。,,,
,1143301,,不要着急，船还在制作中。<br>如果感觉无聊，你可以去<color=#bd4104>自律联盟</color>提升自己实力。,,,
,1143401,,船已经制作完毕，向着下一站出发吧！,,,
,1143501,,后面的冒险，你会遇到更强大的对手<br>如果想从容应对，就多去<color=#bd4104>自律联盟</color>磨练自己,,,
,1143601,,你已经拥有了足够强大的实力，继续你的冒险吧,,,
,1143701,,爷爷，既然他们消失了，那我们又该怎么去找他们？,,,
,1143702,,喔——噜噜噜~这个嘛，或许顺应漩涡的流向，海底的魔法<br>阵会将人们送往纳雅城。不过没有人证实过是否可行……,,,
,1143703,,不试试，怎么知道结果？<br>实在不行，我们再想其他办法。,,,
,1143704,,有时候，我还真是羡慕你的乐天。<br>好，海底魔法阵。我还没有见识过，就陪你走一次！,,,
,1143801,,看来你已经很了解自律联盟的任务模式了，<br>在以后的冒险中也要善加利用哦。,,,
,1143901,,负责任的告诉你，以你目前的实力，<br>恐怕难以应对接下来的冒险，所以请再去<color=#bd4104>自律联盟</color>锻炼下。,,,
,1144001,,负责任的告诉你，以你目前的实力，<br>应对接下来的冒险，完全绰绰有余。,,,
,1144101,吉拉,皇室裁缝的定制款演出服，<br>请把它带给歌姬露娜，一定要小心点！,,,
,1144102,西蒙,放心吧，今晚露娜的演出一定会非常完美！,,,
,1144201,宫廷歌姬露娜,好漂亮啊，我喜欢这套演出服！<br>今晚大家一定会更喜欢我了！,,,
,1144301,吉拉,工程师华洛设计的警报机器人出现了故障，<br>他现在不在，需要你帮忙维修一下。,,,
,1144302,西蒙,明白明白，马上就去。,,,
,1144401,警报机器人·滴,滴滴滴滴滴！！！<br>（啊哈，这是故障已修复的声音）,,,
,1144501,,玛丽即将来到主城探望她的姐姐玛格，<br>请告知玛格这个消息，好让她能提前准备。,,,
,1144502,,是那个喜欢天空城的玛格吗？<br>没问题，我这就去告诉她这个消息。,,,
,1144601,,妹妹！她怎么可以一个人从大贝湾来过来呢？<br>路上充斥着危机，她会不会遇到危险啊！,,,
,1144602,,放心吧！接到委托后，自律联盟已经派人护送她了！,,,
,1144801,,与其虚无的等待，不如帮女巫收集材料吧。有了你们的<br>帮助，女巫的制作效率也会提高哟。,,,
,1144901,,魔能结晶已经制作完毕，马上开始下一段旅程吧！,,,
,1145001,,后面的冒险，你会遇到更强大的对手。<br>如果想从容应对，就多去<color=#bd4104>自律联盟</color>磨练自己。,,,
,1145101,,你已经拥有了足够强大的实力，继续你的冒险吧！,,,
,1145201,,请将这个密令交给从阿克莱斯来的左相特使。<br>他在卡诺萨城王宫入口等着，路上千万不要耽误时间。,,,
,1145202,,知道了，我一定会尽快交到特使手上。,,,
,1145301,,很好，干得不错。虽然我不能透露密令的相关内容，<br>但还是感谢你能这么快把密令送到这里。,,,
,1145302,,……我也没说我想知道啊！,,,
,1145401,吉拉,这次是个苦力活——修剪草坪，<br>希望你能认真对待。,,,
,1145402,西蒙,虽然我觉得很无聊，<br>但作为一个委托任务，还是要好好完成才行。,,,
,1145501,吉拉,联盟晚餐需要一大块王室鲈鱼排，<br>请去卡诺萨商店采购。,,,
,1145502,西蒙,要是因为我让大家饿了肚子，<br>我恐怕要成为罪人了。,,,
,1145601,吉拉,我们发现在主城巡逻的禁卫军中，有伪装者混在了里面。<br>请你找到他，并代表联盟惩罚他。,,,
,1145602,西蒙,交给我了！,,,
,1145701,西蒙,别再演了，你已经被发现了，禁卫军伪装者。,,,
,1145702,禁卫军伪装者,哦？联盟的调查人员果然厉害。<br>不过，别想从我嘴里问出任何东西。,,,
,1145703,西蒙,那就接受惩罚吧！,,,
,1145801,吉拉,巨斧吉塔又在主城闹事了，<br>快去看看！,,,
,1145802,西蒙,吉塔一看就是蛮横不讲理的人！,,,
,1145901,巨斧吉塔,毛头小子，联盟可不是乱管闲事的，<br>这没你的事，快给我滚蛋！,,,
,1145902,西蒙,你扰乱了主城治安，还说我是毛头小子？！<br>那看来我要让你见识一下奥兹剑术了！,,,
,1146001,,可恶！还是被他给跑了。<br>——但这里似乎有一个掉落的东西？,,,
,1146101,,册子上画了一个面具，这似乎在哪里看到过？ ,,,
,1146102,,——是檐鬼！<br>看来这件事和圣界脱不了干系，必须马上回报给联盟才行。,,,
,1146201,,喂！你们好啊！你们是不是帮我找到了？<br>如果找到了，就还给我吧！,,,
,1146202,,可笑！现在还厚着脸皮问我要宝藏！,,,
,1146203,,既然你都发现了，那我……<br>那我就先走为妙……,追缉哥布林冒险者。,先将宝藏归还。,
,1146301,,这明明是宝藏守卫驻守的迷雾宝藏！<br>奇怪，哥布林是不是想利用我们打败守卫获得宝藏。,,,
,1146401,,这么快就不见了……<br>算了，这次先放过他，还是赶紧回去看看宝藏吧。,,,
,1146501,,里面的东西呢？！！！<br>难道是被那个狡猾的哥布林给掉包了？,,,
,1146502,,好气呀，这真的是我经历过的最差劲的一次巡查……,,,
,1146601,,没关系！真正的勇者就是需要不断地历练。<br>年轻人，快领取你的任务奖励吧！,,,
,1146701,,我刚从罗兰镇回来，那里的镇民们都非常着急，<br>说是罗兰镇又要变回奴隶镇了。,,,
,1146702,,这是为什么？难道玫瑰团又在骚扰镇民了？,,,
,1146703,,倒不是玫瑰团的事。我听在那附近流浪的查理说，<br>四蹄神不久就要从大帝重刃的封印中挣脱了。,,,
,1146704,,大帝亲手施加的封印怎么会这么容易就被解除？<br>那个乞丐查理的嘴里可从来没有一句真话。,,,
,1146705,,事关重大，我们最好亲自去罗兰镇，<br>问问帝国委派到镇上的城镇守卫官。,,,
,1146801,,我是城镇守卫官凡特，你们有什么要帮忙的吗？,,,
,1146802,,凡特大人，听说被封印在魔族高地的四蹄神似乎有复苏的迹象，这是真的吗？,,,
,1146803,,没错，一些心怀不轨的鹿角兽携带魔气进入魔族高<br>地，企图破坏封印，我们正在追捕它们。,,,
,1146804,,我的同伴埃克已经前往那里了，无奈我这里人手不<br>够，不知道你们能不能前去支援埃克。,,,
,1146805,,当然可以！四蹄神可是强大的誓魔者，它效忠于魔<br>神，我们不能让那些坏人得逞！,,,
,1146806,,对了，这里有一个<color=#bd4104>召唤卷轴</color>，关键时候，<color=#bd4104>它会为你</color><br><color=#bd4104>召唤一位好友到身边</color>。希望能对你们有所帮助。,,,
,1146807,,谢谢你凡特大人，那我们马上就赶过去。,,,
,1146901,,埃克大人，你快醒醒！,,,
,1146902,,……你们是……快点离开这里……<br>那些魔物已经没办法阻挡了……,,,
,1146903,,是凡特大人让我们来支援你的，<br>你怎么伤得这么重！,,,
,1146904,,这里充满了魔气，这些魔气不仅让魔物更加强大，<br>而且还会削弱大帝重刃的封印。,,,
,1146905,,先别管我了，我还可以坚持……<br>你们得赶紧去检查一下封印，说不定……,,,
,1147001,,人类简直天真！<br>封印迟早会消失，大帝重刃无法一直禁锢我！,,,
,1147002,,到那时候，我会再次降临，为魔神效力的！,,,
,1147003,,现在，先尝尝被我的手下撕咬的痛苦吧！,,,
,1147101,,我们必须阻止这些家伙！,用手中的剑战胜它们！,我想稍后再战。,
,1147201,,魔物还在不断地出现，<br>光凭我们三个好像快顶不住了！,,,
,1147202,,试试那个召唤卷轴，温丽！,,,
,1147301,,拼死守护的时刻到了，我的朋友们！,,,
,1147302,,这些丑陋的家伙就交给我吧！,,,
,1147401,,哦！我的宝贝孙女！爷爷来晚咯！<br>——让爷爷来搞定这些混蛋！,,,
,1147402,,芙蕾雅封禁锢法阵！,,,
,1147501,,……啊，真是个难以对付的对手啊！多亏了泰雷和特<br>罗德大人……温丽大小姐，你没事吧。,,,
,1147502,,我……我想回家！,,,
,1147601,,几位，看到你们脸上的笑容，<br>我想你们似乎有好消息告诉我。,,,
,1147602,,凡特大人，我们救下了您受伤的战友。<br>您给我们的召唤卷轴，也救了我们一命。,,,
,1147603,,那就好。要是再遇到四蹄神这样强大的魔物，千万<br>不要勉强应战，召唤好友一起才是最好的选择。,,,
,1147604,,嗯，我们记住了！<br>就用这个<color=#bd4104>召唤卷轴</color>！,,,
,1147701,,,,,
,1147801,,快看那边！<br>几个卫兵和鹿角兽打起来了，我们快过去帮忙！,,,
,1147901,,各位好久不见！感谢你们的帮助！让我好好推理一<br>下，嗯……是城镇守卫官凡特派你过来的吧？,,,
,1147902,,（真是莫名其妙的推理……）<br>是的，凡特大人叫我们解决鹿角兽的事情。,,,
,1147903,,罗兰镇的鹿角兽刚刚已经被你们解决了，我推测有<br>一些往风车镇方向去了，你们得去那里看看。,,,
,1147904,,好的，大卫先生，谢谢你的情报，我们这就出发。,,,
,1148001,,你们看，这里有好多镇民受了伤，<br>看来是发生过了一场打斗。,,,
,1148002,,那些可恶的鹿角兽，头上的角比我的铲子还硬！,,,
,1148003,,啊啊啊啊！我流血了！<br>我晕血啊……@#￥%,,,
,1148004,,三位！,,,
,1148005,,库伯拉长老爷爷……,,,
,1148006,,为什么你们总是忘记，我！只！有！28！,,,
,1148007,,好了好了，还是要请你们快点帮忙采集草药，<br>帮受伤的镇民们止血。,,,
,1148101,,风车镇已经被我们破坏过了，<br>许多镇民不自量力跟我们作对，还受了重伤……,,,
,1148102,,——是鹿角兽的声音！,,,
,1148103,,嘘！别惊动了它们。,,,
,1148104,,听说接下来首领要袭击阿克莱斯，<br>我们还是赶快回去吧！,,,
,1148105,,看来，危机并没有解决。我们先把东西送给库伯拉<br>长老，再想想对付它们的办法。,,,
,1148201,,辛苦你们了。这次的鹿角兽危机真是出人意料，<br>大家都没做好准备……,,,
,1148202,,是啊，我们本以为战胜了黑战斧就能阻止魔气的传播，没想到魔气早已经扩散了出来。,,,
,1148203,,这说明这背后还有其他人在传播着魔气，<br>而且就是这个人为四蹄神挣脱封印做准备。,,,
,1148204,,可是我们对这个人究竟是谁完全没有头绪，<br>最好的办法就是通知城镇守卫官们加强防卫了。,,,
,1148205,,哎……,,,
,1148301,,它值得你冒生命危险吗？<br>我们都如此爱着你，你不能为了我们而放弃吗？,,,
,1148302,,别人都是为了活命远远地躲开鹿角兽， <br>而你啊，我的米吉帕，你却要一个人去找鹿角兽。,,,
,1148303,,大妈，你这是怎么了？<br>你刚才说的，是那个远近闻名的雕刻家米吉帕？,,,
,1148304,,是他啊，他是我亲爱的儿子。他听说四蹄神要复苏<br>了，就自己一个人去魔族高地了。,,,
,1148305,,为什么？他是个雕刻家，又不是守卫官，<br>难道他还想用雕刻刀打败那里的魔物啊！,,,
,1148306,,他要亲眼见到四蹄神，<br>因为他说只有那样才能做出最栩栩如生的雕刻。,,,
,1148307,,他脑子没问题吧！ 就算他做出了全世界最像的四蹄<br>神雕刻，又能卖多少钱？一百万银币？,,,
,1148308,,大姐头，我们得帮大妈把米吉帕找回来。<br>无论如何，我们都不希望任何人被魔族伤害。,,,
,1148401,,凡特大人，镇上的雕刻家米吉帕独自进入了魔族高<br>地，我们决定去那里找他。,,,
,1148402,,感谢你们告诉我镇民的情况，<br>但我这里的人手不够，没办法派人去帮助你们了。,,,
,1148403,,对了，这里有一个召唤卷轴，如果你希望某个人出<br>现，它就会帮你将他召唤过来。但愿有所帮助。,,,
,1148404,,谢谢你凡特大人，那我们马上就赶过去。,,,
,1148501,,那个黑影是米吉帕吗？<br>他一个人那样真是太危险了！,,,
,1148502,,我们得赶紧追过去，<br>但是你们要小心在附近巡逻的鹿角兽！,,,
,1148601, ,接受本大小姐的惩罚吧！,战胜这些鹿角兽守卫。,我暂时无法作战。,
,1148701,,我……我还能坚持……<br>我一定要看到四蹄神……,,,
,1148702,,自己明明已经都走不动，却还要逞强，<br>为了雕刻连命都不要了。,,,
,1148703,,因为我一定要亲眼看到四蹄神，<br>我才能看到我的父亲……,,,
,1148704,,什么？你的父亲？,,,
,1148705,,五十多年前，罗兰大帝和四蹄神在这里厮杀，<br>我的父亲也参军成为了自由联军的一员……,,,
,1148706,,四蹄神不断地召唤魔物向联军进攻，<br>自由联军的士兵们很难抵挡地住一波又一波魔物。,,,
,1148707,,直到罗兰大帝用大帝重刃将魔物全部封印……<br>战局才被逆转……,,,
,1148708,,可我的父亲……却没能回来……,,,
,1148709,,那些发了狂的魔物，士兵们跟本不是他们的对手，<br>你的父亲……,,,
,1148710,,不！我不相信！人们都说父亲是镇上最勇敢的人，<br>他不可能被魔物打败，他一定是被封印了起来。,,,
,1148711,,我要等到封印被解除的那天，亲自找到他……,,,
,1148712,,所以你根本不是想亲眼见到四蹄神，<br>而是以为你的父亲会和四蹄神一起被释放出来……,,,
,1148713,,是的，我没有见过我的父亲……<br>我一生把无数东西雕刻的栩栩如生……,,,
,1148714,,可我却没有半点办法……还原我父亲的样子……,,,
,1148715,,——你们知道雕刻最重要的是什么吗？,,,
,1148716,,对于我来说，雕刻最重要的是亲眼见到。,,,
,1148801,,愚蠢的人类，<br>别妄想你们的封印可以让我永远消失！,,,
,1148802,,我终有一天会回来，<br>带着恐惧和残忍，将你们踏成灰烬！,,,
,1148803,,不好，四蹄神的亡灵操控了魔物！<br>大家进入作战状态！,,,
,1148901,,魔物还在不断地出现，<br>光凭我们三个好像快顶不住了！,,,
,1148902,,试试那个召唤卷轴，温丽！,,,
,1149001,,拼死守护的时刻到了！,,,
,1149101,,你们没人明白我在这里过的是多么痛苦，<br>到时候，我会加倍偿还的！,,,
,1149201,,……啊，真是个难以对付的对手啊，多亏了泰雷……<br>温丽大小姐，你没事吧。,,,
,1149202,,我……我想回家！,,,
,1149203,,各位，我们以后会面临更强大的敌人，但我们也能<br>再次叫上好朋友们一起战斗！大家一定要加油啊！,,,
,1149301,,儿子……我亲爱的儿子……你没事吧？,,,
,1149302,,我没能见到我的父亲，妈妈，<br>我……,,,
,1149303,,你的父亲是个战士，米吉帕，<br>你也一样继承了他的勇敢和坚强。你，就是他。,,,
,1149401,,我们也该回去了，<br>伟大的雕刻家，还有伟大的妈妈，祝福你们。,,,
,1149402,,哎，等等，我有些东西要送给你们，<br>它们是我最新作品。,,,
,1149403,,是可爱的鹿角兽雕像！！！,,,
,1149404,,是值钱的鹿角兽雕像！<br>这可是大名鼎鼎的雕刻家米吉帕啊！,,,
,1149501,,温丽，大姐头，我们也一起上吧！,,,
,1149502,,芙蕾雅家的大小姐可绝不会认输！,,,
,1149503,,让老娘的拳头再会会它！,,,
,1149601,,,,,
,1149701,,,,,
,1150701,,这是戈壁火狐的脚印，它们喜欢火焰，从中获取火焰能量作<br>为食物。上次冒险者营地的火灾很可能就是它们干的！,,,
,1150801,,前些天，冒险者营地发生了火灾，我们在营地附近发现了你<br>的脚印，你怎么解释！,,,
,1150802,,你在说什么？我们戈壁火狐虽然需要汲取火焰能量，但从来<br>不会故意放火。,,,
,1150803,,上次我看到一个黑影在冒险者营地附近出现，然后……<br>然后我就看到了一团火，就过去汲取了那里的能量……,,,
,1150804,,你是说还有其他人到附近来过……<br>我不知道你说的是不是真的，但如果……,,,
,1150901,,可恶……我没能追上他……<br>那个黑影究竟是谁……,,,
,1150902,,我得赶紧回去通知冒险者们，<br>让他们加强一下营地的巡逻。,,,
,1151001,？？？,多嘴的家伙，我看你还是永远不要再见到火焰才好！,,,
,1151002,,有一个黑影？！不好，戈壁火狐受伤了！<br>你们照顾好火狐，我去追那个黑影！,,,
,1151101,不死者,吼——吼——,,,
,1151201,???,狂暴吧！<br>这种破坏真是令人兴奋呢！,,,
,1151301,,最近在冒险者营地发生的事件迟迟没有解决，<br>真希望有人能帮我们调查清楚。,,,
,1151401,,得来全不费功夫！<br>这个宝贝让我给找到了，发财了发财了……,,,
,1151501,,滚开，别想打这个宝藏的主意！<br>否则我要你有来无回！,,,
,1151601,,太可怕了，这么强大的宝藏守卫！<br>看来我得想个办法才行。,,,
,1151701,,哇，这么多宝藏，差点就落在那个混蛋手里了。,,,
,1151702,,刚才宝藏守卫说这是精灵族的迷雾宝藏，<br>我想我们应该把宝藏送到树心城去。,,,
,1151801,,每一个巡查员都代表着罗兰帝国，<br>面对古加尼尔这么多部落，巡查工作可不能懈怠！,,,
,1151901,,不好了首领大人，<br>树神的上古魔法突然出现了衰弱，该怎么办？,,,
,1151902,,看来我们树人部落要遭受一场浩劫了……,,,
,1152001,,希望有人能帮我们找到那个东西，拯救树人部落。,,,
,1152101,,洛克首领，你这是怎么了？,,,
,1152102,,树人部落的神树出现了问题，体内的上古魔法突然衰弱。<br>只有月神水晶能够帮助回复神树的魔法。,,,
,1152103,,月神水晶存量特别少，<br>不知道你们能不能也帮助我们去找一找。,,,
,1152104,,好的，包在我们身上！,,,
,1152201,,西蒙，你们找到月神水晶了吧？,,,
,1152202,,我们刚刚发现了一块月神水晶！,,,
,1152203,,让我看看吧，因为有些水晶并没有能量，<br>还是要好好鉴定一下。,交给树人首领洛克鉴定。,为什么首领会突然出现在这里？,
,1152301,,嗯，这块水晶里的能量还很充足。,,,
,1152302,,你们要先赶紧回部落，把它放入神树的体内吧！<br>我腿脚不灵活，跟不上你们咯！,,,
,1152401,,诶？那不是洛克首领吗？<br>它怎么这么快就返回部落了？,,,
,1152501,,洛克首领，你怎么这么快就回到部落了？<br>刚才你还在那边帮我们鉴定水晶来着。,,,
,1152502,,我一直在部落里啊，西蒙。<br>让我看看这块水晶……,,,
,1152503,,这是一块没有能量的假水晶……<br>我想你们是不是遇到了骗子。,,,
,1152504,,可恶……我得赶紧回去找它！,,,
,1152601,,月神水晶的力量——属于我！！！,,,
,1152602,,不！！！,阻止它吸收水晶能量！,等我再想想对策。,
,1152701,,这块月神水晶破被坏了……我听说矿洞附近有人也发现过月<br>神水晶，也许下次我去那里看看。,,,
,1152801,,做得不错！真正的勇者就是需要不断地历练。<br>年轻人，快领取你的任务奖励吧！,,,
,1152901,,洛克首领，你怎么在这？,,,
,1152902,,哎呀，我是担心你们遇到什么困难就特地……,,,
,1152903,,洛克首领，我先不听你说了！<br>我得赶快把水晶送回部落啦！,,,
,1153001,,诶？那不是洛克首领吗？<br>它怎么这么快就返回部落了？,,,
,1153101,,洛克首领，你怎么这么快就回到部落了？<br>刚才你还在那边找我们鉴定水晶来着。,,,
,1153102,,我一直在部落里啊，西蒙，<br>我想你们是遇到了骗子。,,,
,1153103,,呼——幸好……,,,
,1153104,,月神水晶的力量——属于我！！！<br>刚才被你识破了，现在别怪我不客气了！,阻止这个家伙夺走月神水晶！,看起来暂时无法战胜它。,
