,id,title,text,address,name
备注,id,邮件标题,邮件正文,发件人地址,发件人名字
,2,危机黯月城顺位奖励,您经过不懈的努力后通关了第%d层副本，位列本层的第%d顺位。这些是您应得的奖励，还请您收下。,魔法协会,魔法协会秘书处
,3,危机黯月城积分奖励,您忘记领取的第%d层副本的第%d档奖励，在此特地为您送上，愿您能取得更好的成绩。,魔法协会,魔法协会秘书处
,4,古加尼尔之息活动奖励,哟，当你看到这份信件的时候，古加尼尔之息已经在<color=#bd1011>%s</color>结束，我也已经和族人回到森林了。容我代表森林，感谢您这段时间的贡献。 说来，你当时还有%d颗神树之实在我这里没兑换。以防万一，我随信附带了对应的密林赠礼，还请及时收下吧。,德鲁伊沃诺特,风迹速递树心城分部
,5,圣界来袭个人奖励,年轻人，你在圣界来袭活动中干得不错，位列所有冒险者中第%d名，颇有点我当年讨伐魔族的气势！这些奖励你就先收下吧，这是我对你的肯定！,自律联盟,铁臂安道夫
,6,圣界来袭公会奖励,年轻人，看来你找了个不错的公会！圣界来袭活动中，你和你所在公会的表现让人眼前一亮，在所有公会的排名中位列第%d名。这是属于你的奖励，尽管收下！,自律联盟,铁臂安道夫
,7,叮！王牌通缉奖励，请查收！,在王牌通缉活动中，你的表现超棒的，通缉积分达到%d！给，这是你的第%d档奖励！下次，我们再一起继续去缉拿坏人哦！,自律联盟,纳塔娜