,id,title,text,address,name
备注,id,邮件标题,邮件正文,发件人地址,发件人名字
,1,加入公会通知,欢迎加入<color=#386bc6>%s</color>。愿未来冒险之路，你不再孤单。,自律联盟,铁臂安道夫
,2,公会除名通知,很遗憾，由于您违背了公会条约，您已被<color=#386bc6>%s</color>除名。,自律联盟,铁臂安道夫
,3,公会职位任命通知,恭喜您，您已被任命为<color=#386bc6>%s</color>的<color=#386bc6>%s</color>。,自律联盟,铁臂安道夫
,4,公会会长任命通知,恭喜您，您已被任命为<color=#386bc6>%s</color>的<color=#386bc6>%s</color>。,自律联盟,铁臂安道夫
,5,公会解散通知,很遗憾地通知您，<color=#386bc6>%s</color>已被会长解散。,自律联盟,铁臂安道夫
,6,公会创建失败通知,很遗憾地通知您，<color=#386bc6>%s</color>未在限定时间内达成条件，因此公会创建失败。,自律联盟,铁臂安道夫