,id,talkName,dialogue,firstBtnText,secondBtnText,actionText
,638501,,西蒙，居然能在这里遇见你们，太神奇了。<br>不过，你们好像少了一个人啊！,,,
,638502,,对啊，他居然又将无辜的生物抓来做实验，我们可…… <br>等等，你怎么会知道我的名字……,,,
,638503,,蕾茵！？这里这么危险，你怎么会在这里？<br>啊！你说的那位，她的魔法杖刚好出了问题，没有跟过来。,,,
,638601,,对不起，对不起，对不起，蕾茵还不擅长在这种地形行走，<br>拖慢了整个团队的前进速度，对不起……,,,
,638602,,蕾茵，你这样一直道歉，害我以为你又被扬博士抓住了。<br>不过你怎么跟着佣兵来到这里了？这里可不安全。,,,
,638603,,虽然危险，但是蕾茵也希望自己能救出那些被困的人<br>正好佣兵们请我协助他们，我便鼓起勇气跟了过来。,,,
,638701,,真是的，需要她的魔法时她却不在，还跑去吃什么甜品。<br>这里实在太黑了……是谁？难道又是合成兽吗？,,,
,638702,,对不起，对不起，蕾茵不是故意的……西蒙？是你吗？<br>蕾茵跟着佣兵们来这里进行援救，一不小心就掉进来了。,,,
,638703,,没想到是你，还好我没动手。现在我们先往光源前进吧！<br>等一下，我先把刚才掉在地上的剑捡起来……咦！,,,
,638704,,西蒙，等一下！你，你拿错了，那个不是你的剑，<br>那……那是蕾茵的尾巴！,,,
,638801,,你们看，前面的吊篮开始运转了，有个人影站在上面！,,,
,638802,,怎么又是你们这群人，老是追着我，真烦人！,,,
,638901,,哼！看来你们也很想成为我的实验品，那就来吧！,,,
,1043401,？？？,哈哈哈，不堪一击的蝼蚁！你们还费尽心机找什么女王？<br>罗兰帝国终归是我的囊中之物！,,,
,1049501,,放心吧，我会保护好由莉！<br>倒是大小姐，你自己小心点。,代表芙蕾雅家族惩罚你！,,
,1051901,,圣界集合~,,,
,1069301,,喂……我不是……<br>啊，真是受够了！专门遇到莫名其妙的家伙。,好，我接受你的挑战,我要缓冲下，稍等片刻,
,1069501,,,,,
,1069502,,放心吧，我会保护好由莉！<br>倒是大小姐，你自己小心点。,代表芙蕾雅家族惩罚你！,,
,1072001,,,,,
,1087701,,巡查任务就是逛逛城镇，顺便解决几个小麻烦，<br>怎样，没有比这还轻松的工作了吧。,,,
,1089501,,你好，请问这里发生了什么？总感觉怪怪的。,,,
,1089502,,哀嚎神殿区域充斥着恶灵气息，魔物因此肆无忌惮。<br>我的探查工作无法继续展开。,,,
,1089503,,原来是这样，让我来找到恶灵气息的来源。,,,
,1100701,,他想利用我们获得迷雾宝藏！<br>真是太狡猾了！,,,
,1100702,,没错，是他撒了谎。<br>不过，我们还是把宝藏送回联盟吧。,,,
,1103701,,副本在制作中，暂未开放,,,
,1143701,,爷爷，既然他们消失了，那我们又该怎么去找他们？,,,
,1143702,,喔——噜噜噜~这个嘛，或许顺应漩涡的流向，海底的魔法<br>阵会将人们送往纳雅城。不过没有人证实过是否可行……,,,
,1143703,,不试试，怎么知道结果？<br>实在不行，我们再想其他办法。,,,
,1143704,,有时候，我还真是羡慕你的乐天。<br>好，海底魔法阵。我还没有见识过，就陪你走一次！,,,
,1146301,,这明明是宝藏守卫驻守的迷雾宝藏！<br>奇怪，哥布林是不是想利用我们打败守卫获得宝藏。,,,
,1193101,,自从上次魔族侵入这儿后，附近的生物都魔化了。<br>这些魔物频频袭击路人，实在可恨。,,,
,1193102,,那还不简单，我们去消灭它们！,斩尽所有魔物！,稍后再教训它。,
,1193201,,西蒙，我听说你们奥兹家族有个试炼场。试炼场留有<br>所有剑士的最高战斗力，并生成了一个排行榜。,,,
,1193202,,家族内的剑士随时随地都可以发起挑战。成功的话，便能<br>刷新排名与战斗力。所以你在里面的排名是多少呀？,,,
,1193203,,咳……呃……以前不重要，现在才是关键。凭我如今的<br>实力，即使不能战胜第一名，赢过泰雷也是不在话下的。,,,
,1193204,,你倒是很有信心，那我拭目以待了。,,,
,1193205,,那是自然，等着我获胜的好消息吧！,见识见识奥兹的力量！,再练习一会，等会再战。,
,1209601,,(与大臣们协商后，赫丽女王委托西蒙等人出使纳雅，查清<br>事件缘由。西蒙等人欣然接受，并来到已修复的飞船前。）,,,
,1211201,,纳雅人设计的飞船工艺精巧，修复它还需要点时间。现在的话，不妨去<color=#bd4104>自律联盟</color>做些任务，打发时间。,,,
,1211301,,在你的帮助下，飞船顺利修复了。<br>那么，请系好安全带，开启下一段旅程吧！,,,
,1244101,,,,,
,1259701,,《罗兰颂歌》已经找到了，你还傻站着干什么？走啦。,,,
,1259702,,可是，我总觉得还有其他东西藏在这里，再找找吧！<br>就几分钟，再等我几分钟吧。,,,
,1259703,,真的是……好吧，你快点！太久的话，我可不等你。,,,
,1264501,,喵酱决定了，此刻你就是喵酱心中最强的速递员呢！<br>这是给你的奖励，接下去也要继续努力哦！,,,
,1264502,,喵喵喵,,,
,1264503,,酱酱酱,,,
,1264504,,速递员呢！,,,
,1264505,,最强的速递员,,,
,1300501,,,,,
