,id,talkName,dialogue,firstBtnText,secondBtnText,actionText,dialogue_Japanese
备注,索引id,强制名称,对白内容,第一个按钮文本,第二个按钮文本,action的文本参数,日配对白内容
,214901,,又来？！以后我要在这里立一个牌子，上面大大写着：“休息中！”,,,,又来？！以后我要在这里立一个牌子，上面大大写着：“休息中！”
,1286301,,你们都有所了解，那么我就不多说了。等你们准备好后，就去三女神码头乘船前往海地斯监狱。,,,,你们都有所了解，那么我就不多说了。等你们准备好后，就去三女神码头乘船前往海地斯监狱。
,1286407,,为了维持正常司法工作，帝国皇室会在特定的时间安排船只前往海地斯岛。,,,,为了维持正常司法工作，帝国皇室会在特定的时间安排船只前往海地斯岛。
,1286408,,你们先做准备，等时间一到，就马上从三女神码头乘船出发。,,,,你们先做准备，等时间一到，就马上从三女神码头乘船出发。
,1286604,,什么脑回路，都说了危险，你还赶着去？得了，管不了你。不过我还没有开工，耐心等着吧。,,,,什么脑回路，都说了危险，你还赶着去？得了，管不了你。不过我还没有开工，耐心等着吧。
